{
  "version": 2,
  "validated": false,
  "coordinate_space": "normalized",
  "defaults": {
    "min_area": 64,
    "merge_gap": 4,
    "chroma_policy": "edge-connected"
  },
  "boards": {
    "PROTAGONIST_SOURCE": {
      "source_file": "03_protagonist_source.png",
      "status": "seen_not_on_disk",
      "reference_only": false,
      "detection": {
        "min_area": 400,
        "merge_gap": 6,
        "chroma_policy": "edge-connected"
      },
      "expected_regions": 12,
      "overrides": {},
      "outputs": {
        "hero.png": {
          "native_frame": [
            32,
            48
          ],
          "alignment": "foot-baseline",
          "note": "Frames 0-7 use foot-baseline. Frames 8-9 are overridden to 'airborne' by the processor. Region ids assume 12 detected regions in reading order: r0-r5 top row, r6-r11 bottom row. IF DETECTION FINDS 13, EVERY ID BELOW SHIFTS AND THIS BLOCK MUST BE REWRITTEN.",
          "frames": [
            {
              "region": "r0",
              "role": "idle A",
              "confidence": "draft_unvalidated",
              "note": "Top row 1: standing, feet together, arms down."
            },
            {
              "region": "r1",
              "role": "idle B",
              "confidence": "draft_unvalidated",
              "note": "Top row 2: near-duplicate of r0 with a small arm/hand difference. Acceptable as a 2-frame idle breathe; if too similar, swap for a bottom-row standing pose."
            },
            {
              "region": "r2",
              "role": "run contact",
              "confidence": "draft_unvalidated"
            },
            {
              "region": "r3",
              "role": "run compression",
              "confidence": "draft_unvalidated"
            },
            {
              "region": "r4",
              "role": "run passing",
              "confidence": "draft_unvalidated"
            },
            {
              "region": "r5",
              "role": "run extension",
              "confidence": "draft_unvalidated"
            },
            {
              "region": "r9",
              "role": "opposite-foot contact",
              "confidence": "ambiguous",
              "note": "Bottom row: the striding pose with fists raised. Ambiguous - bottom-row poses 0-3 read as standing/walking variants and any of them could serve."
            },
            {
              "region": "r11",
              "role": "airborne recovery",
              "confidence": "ambiguous",
              "note": "Bottom row: the leaping pose with the trailing leg extended."
            },
            {
              "region": "r10",
              "role": "raised-knee jump",
              "confidence": "draft_unvalidated",
              "note": "Bottom row: the clearest airborne pose - raised knee plus raised arm."
            },
            {
              "region": "r8",
              "role": "compact fall",
              "confidence": "ambiguous",
              "note": "Handoff says the compact fall sits at the far right of the bottom row. Visual inspection is not conclusive about which of the right-hand poses is the fall vs the leap. VERIFY ON THE CONTACT SHEET."
            }
          ]
        }
      },
      "skip": [],
      "notes": [
        "UNVALIDATED DRAFT. No rect in this block has been checked against real pixel coordinates.",
        "Visual count of the bottom row is 6 OR 7. If the detector reports 13 regions, expected_regions and every region id must be corrected before processing.",
        "Character faces RIGHT in the run poses, matching the gameplay reference. Any pose detected facing left must get flip_h: true so facing is consistent across the sheet.",
        "Preserve: hair silhouette, beard, white ID badge on lanyard, hands/fists, brown shoes. The badge is the highest-risk detail - roughly 2x3 px after normalization.",
        "Source figures are approximately 100-110 px tall; normalizing to 48 px is a non-integer ~1:2.2 downscale. Nearest-neighbour will drop rows unevenly and can eat the badge and facial features. See ASSET_PIPELINE.md section 6.3."
      ]
    },
    "HUD_BLOCKS_SOURCE": {
      "source_file": "07_hud_blocks_source.png",
      "status": "seen_not_on_disk",
      "reference_only": false,
      "detection": {
        "min_area": 120,
        "merge_gap": 4,
        "chroma_policy": "edge-connected"
      },
      "expected_regions": 13,
      "overrides": {},
      "outputs": {
        "gameplay-tiles.png": {
          "native_frame": [
            16,
            16
          ],
          "alignment": "tile",
          "note": "9 blocks observed in two rows: 4 on the top row, 5 on the second row. Reading order gives r0-r3 then r4-r8.",
          "frames": [
            {
              "region": "r0",
              "role": "terminal_command",
              "confidence": "visually_validated",
              "note": "Bright gold block with a '>_' prompt glyph. Unmistakable."
            },
            {
              "region": "r1",
              "role": "stone_left",
              "confidence": "ambiguous",
              "note": "The board supplies FOUR tan stone variants, not an explicit left/center/right/under set. This mapping is a guess by board order."
            },
            {
              "region": "r2",
              "role": "stone_center",
              "confidence": "ambiguous",
              "note": "Must be the variant that tiles seamlessly with itself. Pick by running the tile_seam validation check across all four candidates."
            },
            {
              "region": "r3",
              "role": "stone_right",
              "confidence": "ambiguous"
            },
            {
              "region": "r4",
              "role": "stone_under",
              "confidence": "ambiguous",
              "note": "The darker, more heavily cracked stone variant on the second row reads best as an underside."
            },
            {
              "region": "r5",
              "role": "dark_inactive",
              "confidence": "visually_validated",
              "note": "Flat dark grey panel with a plain border."
            },
            {
              "region": "r6",
              "role": "warning",
              "confidence": "visually_validated",
              "note": "Yellow/black hazard stripes framing a red warning triangle."
            },
            {
              "region": "r7",
              "role": "breakable",
              "confidence": "visually_validated",
              "note": "Grey rubble stone, already in the cracked state the handoff asks for."
            },
            {
              "region": "r8",
              "role": "exit_terminal",
              "confidence": "visually_validated",
              "note": "Green-screen terminal showing an arrow-into-door glyph."
            }
          ]
        },
        "hud-top.png": {
          "native_frame": [
            480,
            30
          ],
          "alignment": "none",
          "note": "Full-width strip. Baked decorative headings observed: OPS HERO, SCORE, JOBS, ALERTS, COINS, PF KEYS, SYS STATUS. PF1-PF12 button labels are also baked and should STAY baked; only the active-key highlight is drawn dynamically.",
          "frames": [
            {
              "region": "r9",
              "role": "top bar frame",
              "confidence": "draft_unvalidated"
            }
          ]
        },
        "hud-viewdata.png": {
          "native_frame": [
            196,
            56
          ],
          "alignment": "none",
          "note": "VIEWDATA 3270 casing with an empty dark screen. The screen is already blank in the source - no cleaning needed, only dynamic text on top.",
          "frames": [
            {
              "region": "r10",
              "role": "viewdata panel",
              "confidence": "draft_unvalidated"
            }
          ]
        },
        "hud-minimap.png": {
          "native_frame": [
            124,
            56
          ],
          "alignment": "none",
          "note": "MAP panel with a dotted grid and no markers. Already clean.",
          "frames": [
            {
              "region": "r11",
              "role": "minimap panel",
              "confidence": "draft_unvalidated"
            }
          ]
        },
        "hud-bottom.png": {
          "native_frame": [
            480,
            56
          ],
          "alignment": "none",
          "note": "Full-width strip, NOT a 160px right-hand panel as the first draft of the spec assumed. Contains CURRENT MISSION, OBJECTIVE, ITEM, AUTOMATION and POWER sections side by side.",
          "frames": [
            {
              "region": "r12",
              "role": "bottom bar frame",
              "confidence": "draft_unvalidated"
            }
          ]
        }
      },
      "clean_regions": [],
      "notes": [
        "UNVALIDATED DRAFT. clean_regions is deliberately EMPTY: rects cannot be authored before the file exists. See ASSET_INTAKE.md section 4 for the list of regions that will need cleaning.",
        "Good news from inspection: the POWER meter is already drawn EMPTY in the source, and the VIEWDATA and MAP screens are already blank. Far less cleaning is needed than the original handoff assumed.",
        "Cleaning IS still required for: the baked 'ALL SYSTEMS GO' status string, the baked SYS STATUS activity graph, the baked gold star in the ITEM slot, and the five baked robot glyphs in AUTOMATION."
      ]
    },
    "ENVIRONMENT_SOURCE": {
      "source_file": "08_environment_source.png",
      "status": "seen_not_on_disk",
      "reference_only": false,
      "detection": {
        "min_area": 150,
        "merge_gap": 4,
        "chroma_policy": "edge-connected"
      },
      "expected_regions": 17,
      "overrides": {},
      "outputs": {},
      "skip": [],
      "notes": [
        "UNVALIDATED DRAFT.",